item_id,sentence,lang_LH_AntTemp,lang_LH_IFG,lang_LH_IFGorb,lang_LH_MFG,lang_LH_PostTemp,lang_LH_netw
B.735,Do any stand out in particular?,-0.06547238139999997,0.239324272,-0.27578217,-0.207848158,0.168156496,0.059822978000000006
B.736,She'll love meeting Maggie and Smythe!,-0.031138984599999996,-0.3469341819999999,-0.2371783174,-0.04644336600000001,0.329149786,0.08921408
B.737,This allows for much more accuracy.,-0.23448600099999997,0.01198015080000002,-0.13572588200000002,-0.11521298199999996,-0.3071569799999999,-0.22426399200000002
B.738,Sunday School classes begin at 9:30am.,-0.150380442,-0.21289543279999998,-0.758312356,-0.7576439180000001,-0.30002485,-0.312241987
B.739,Stir-fried egg noodles with assorted vegetables.,-0.234112046,0.499468702,0.013445713000000015,0.22375872599999996,-0.1156959922,-0.038600078999999995
B.740,And how does it impact mobile?,0.08041458400000001,0.13980599600000004,-0.42306631,0.4204002338,0.055590417999999996,0.07147089348
B.741,"Emilio, stand up for a second.",-0.2919161,-0.35315801579999995,-0.5600776319999999,-0.528668796,-0.5707695018000001,-0.46680164
B.742,I've said it hundreds of times.,-0.39252375199999995,-0.09087764820000001,-0.45732479000000004,-0.23540997,-0.4594497968000001,-0.37977343919999995
B.743,"It's not his fault, come on.",-0.10102665,-0.234518552,-0.45143694539999996,-0.6672438140000001,-0.163238236,-0.211143006
B.744,This is really good for democracy.,0.284576122,-0.2678720680000001,-0.11645334199999999,0.032261316,-0.004503278000000008,0.035939338000000015
B.745,Everything changed for all of us.,0.030449242000000015,-0.673495728,-0.992396724,-0.43730516999999997,-0.149924896,-0.2383288684
B.746,"Looking at the scene there, Daryn.",0.32451027,0.404511408,0.250135878,0.7974931460000001,0.45963243600000003,0.43040899999999993
B.747,Addiction is not a pretty face.,0.693347094,0.671016574,1.34490004,0.167907472,0.49342835679999997,0.59409416
B.748,And I've actually spoken with him.,0.2255706076,0.19664707799999995,0.09913871999999999,-0.22044770200000002,-0.03769769960000001,0.0546235782
B.749,But monopolies have been regulated before.,-0.005113540599999988,-0.306548262,-0.352970066,-0.6942718595999999,-0.2565545474,-0.2353305002
B.750,You can see the damage here.,-0.329013284,-0.10398467,-0.16222878000000002,-0.2856334118,-0.3895797432,-0.31731162
B.751,I tried during the 2000 campaign.,0.229650148,-0.632326354,-0.494230906,-0.408708604,0.09830632200000003,-0.029962687999999994
B.752,Back with more right after this.,0.450549142,0.016309178,-0.022102751999999982,0.07264093800000002,0.09701229400000001,0.1716007136
B.753,"Well, it's hard to say, Geraldo.",-0.012680623999999984,-0.264089664,0.06699834000000002,0.06264474599999999,-0.09775847500000001,-0.07340206560000001
B.754,Let's get it going once again.,-0.12182457199999999,0.11697397600000001,0.43872465800000005,0.053974644799999985,0.18920400199999998,0.10291788800000001
B.755,You bet there's other things here.,0.15619191999999998,-0.2170925332,-0.453935142,-0.877550694,-0.06282475540000002,-0.1092323986
B.756,"Dan Schorr, of course, joins us.",0.6706178460000001,0.22973225840000003,0.3499068812,0.20396840999999996,0.41799943759999997,0.44146400999999996
B.757,"Get out of here, you guys.",-0.201731098,-0.357531968,-0.13028344400000003,-0.519994266,-0.27765410399999996,-0.27692908000000005
B.758,It's not -- it's important to me.,0.28502428599999996,0.9505041200000001,0.8526228100000001,0.898617632,0.7980370192,0.6919768808
B.759,There were probably five of them.,-0.15817119000000002,-0.535645822,-0.70665211,-0.4027130359999999,-0.368843806,-0.35630123399999997
B.760,I don't know much about him.,0.150356874,0.29221096,0.17609825199999996,0.08111147400000003,-0.11322938400000002,0.037843137999999985
B.761,I started listening to satellite radio.,0.7853836264,0.29281554853999997,0.45808864,0.16504999999999997,0.367410792,0.45878676
B.762,I get to ask the question.,0.07423608399999997,-0.72324862,-0.2864567264,-0.030273693999999997,-0.13723067580000003,-0.15340041580000002
B.763,"No, I'm talking about the staff.",-0.04169713534000001,-0.07637684,-0.08545432000000001,0.05252093000000002,-0.162267228,-0.09900657199999996
B.764,They had moved to Oklahoma Territory.,0.259451946,0.44612697,0.6391000339999999,0.35138944800000005,0.445523491,0.400877942
B.765,The figures mark a significant turnaround.,0.250214808,-0.127986358,0.194229986,0.156910138,-0.24450963519999996,-0.0427601766
B.766,They don't view it that way.,-0.7684564119999999,-0.329896788,-0.35604782,-0.07737033719999997,-0.574708948,-0.545137718
B.767,I will make that commitment today.,-0.2711196894,-0.7663888520000001,-1.140785218,-0.814152458,-0.790011406,-0.672932516
B.768,We need to all come together.,-0.7062915860000001,-0.267192704,-0.704830429,-0.474730108,-0.5989477919999999,-0.58386647
B.769,So I don't want anybody's sympathy.,0.571880054,0.284909692,0.994209644,0.5219836339999999,0.47398945000000003,0.5117188784
B.770,This is a call for help.,-0.14233654599999998,-0.27058010439999997,-0.484411114,-0.326442124,-0.524955148,-0.375400636
B.771,And that is a direct strategy.,-0.30621142560000003,-0.45812076999999995,-0.18445240000000002,-0.10555267200000003,-0.2545541986,-0.277391634
B.772,I'm going to take him on.,-0.669248744,-0.2272240864,-0.48177587400000005,-0.515914494,-0.32884389599999997,-0.42984116400000005
B.773,She has buried all of them.,0.41532197800000004,-0.08449980399999998,-0.03239648221999999,-0.38109922100000004,-0.1469324612,-0.0017754039999999915
B.774,"Again, it's been nearly a week.",-0.026424040000000027,0.21543546400000002,0.385667742,0.38968625800000006,0.12824305600000002,0.133334436
B.775,"Here it comes, the unknown DNA.",0.293745554,0.3113338252,-0.013323487999999984,-0.06796342399999997,0.08995356799999998,0.152478842
B.776,We do have an air lock.,0.15268247559999998,0.11507180000000003,-0.270210404,-0.2337840196,0.037647399999999956,0.03831109799999999
B.777,"Senator Edwards, good luck to you.",0.234959528,0.14433458799999999,0.05361466999999999,-0.32666678200000004,-0.10833763599999999,0.006149536
B.778,The terror camp was never built.,-0.11112904199999998,-0.170961804,-0.3048125284,-0.45953031199999994,-0.2377965664,-0.217118646
B.779,"It was just a symptom, really.",0.07360364020000001,-0.6525380566,-0.38553622600000004,-0.3946435,-0.5124333759999999,-0.358061333
B.780,He joins us now from Phoenix.,0.15772929799999996,0.835586071,0.273349998,-0.23179425,-0.08953926000000001,0.0991642466
B.781,It was a deadly lung cancer.,-0.140403392,0.1583464808,0.14503115640000003,0.254241526,-0.043939057999999996,-0.010788151800000001
B.782,This is a really weird question.,0.38149662566,0.54525398,0.736883908,0.5909988559999999,0.49515663,0.49301594400000004
B.783,Thousands of innocent lives were lost.,0.5374891340000001,-0.146724248,0.13017555200000003,-0.164136428,0.22550734,0.227282356
B.784,"Larry, thanks for coming in today.",-0.13477014400000004,0.095308396,-0.395533136,0.15092912260000002,-0.11528050640000001,-0.0913585814
B.785,I'm sick of the whole scene.,0.11759676560000001,0.140888224,-0.24716622200000007,-0.29949104559999995,-0.20491399019999998,-0.08741655499999998
B.786,"You know, the world loves him.",0.216925274,-0.42591584258,-0.0876684206,-0.29628677200000003,0.048438149400000005,0.000867361199999972
B.787,He don't look nothing like Ricky.,-0.08127496600000002,0.488720162,0.40272485894,0.284158074,0.139900458,0.150620844
B.788,Ross Perot evidently has no plan.,0.5400521038,-0.046919423999999973,0.33293246000000004,0.143845828,0.09449689000000001,0.21307194200000001
B.789,So let's let that go forward.,-0.38538416499999995,0.010303724000000025,-0.19573406,0.552470296,-0.012628132000000037,-0.07624959200000002
B.790,It is the next entertainment revolution.,0.5371464904,-0.39118469699999997,0.256955669,0.07613542000000004,-0.188799106,0.025293466000000004
B.791,We wouldn't have seen analog cassettes.,0.5272442427999999,0.6247770349999999,0.470647792,0.04880775005999998,0.424450498,0.450113274
B.792,They are just defending the law.,-0.31265259,-0.22372199619999997,-0.543502234,-0.544449944,-0.531064462,-0.437770356
B.793,She loves to go to church.,-0.62670196,0.021558710999999998,-0.331845752,0.08397275600000002,-0.19655114199999998,-0.2704208236
B.794,I have a very supportive husband.,0.49631818,0.2691813740000001,0.7810920219999999,0.35383420479999994,0.29991316,0.38102697199999996
B.795,You're listening to DAY TO DAY.,0.8571169945,1.2553738625,1.111960415,1.2456308,1.0395812549999999,1.037644725
B.796,That's what they wanted to communicate.,-0.228430036,-0.9472502572,-0.522210514,-0.655177052,-0.722159768,-0.6019939599999999
B.797,"Boy, I'm taking a deep breath.",0.663991952,-0.201762816,0.41906452400000005,0.172671294,0.5755683580000001,0.464363218
B.798,No I think just the opposite.,0.3608731848,-0.333148742,0.4800199180000001,0.004615155999999987,-0.09115330533999999,0.040394748
B.799,I am Steven Segal's litigation attorney.,0.2339398744,0.696802894,0.45046933200000006,0.4457069436,0.4761985796,0.43514851400000004
B.800,And you can ask me why.,0.21807184799999998,-0.297483526,-0.4282341056000001,0.06137288399999998,-0.015367209999999997,-0.006902803999999996
B.801,I want everybody to do well.,0.06302247599999997,-0.27712972999999996,-0.7330392480000001,-0.02113169800000001,-0.06125650999999997,-0.09189376999999997
B.802,"Where those -- look, here he goes.",0.1699538828,0.5327088520000001,-0.165752242,1.0687471519999998,0.371450434,0.35872236507999994
B.803,His parents are from Hong Kong.,-0.8725501120000001,-0.19186495460000003,-0.617153214,-0.09941867800000001,-0.480815298,-0.5283037126
B.804,And command doesn't first believe them.,0.46044931,0.05428753800000001,0.41380523999999996,0.5525575030800001,0.3647495178,0.36954114320000003
B.805,Please let me answer the question.,0.07972551200000003,-0.349566528,-0.6337069399999999,-0.608315756,-0.26174862,-0.23091763200000007
B.806,Dennis doesn't recall that it happened.,0.148154114,0.24830886,-0.0038219039999999984,-0.030647703999999987,0.17510378,0.150479889
B.807,"Finally, he was this past Friday.",0.15100598599999998,0.48119554999999997,0.4197828,1.5801176399999999,0.777757248,0.6157855008
B.808,You can't start with individual programs.,0.469611592,0.07132018599999998,0.32792433800000004,0.16907120800000003,0.15176466319999998,0.23783739600000003
B.809,She also has a great wig.,-0.560390852,-0.640430164,-0.568540896,-0.555671172,-0.8673623300000001,-0.717018658
B.810,"Anyway, all that and much more.",-0.001231904000000017,0.7391150160000001,0.235465284,0.603778802,0.24997730599999998,0.269150526
B.811,"I'm like, I'm a little down.",0.604472523,0.6209870860000001,1.077638528,1.3467533,0.9115393380000001,0.8382125199999999
B.812,It still seems a little unreal.,-0.131923316,-0.08257521000000004,-0.21674697000000004,-0.29689555,-0.30429924599999997,-0.225994642
B.813,He's going to be more powerful.,-0.21814771200000002,-0.6223339647999999,-0.6708012334,-0.2554699588,-0.43362221199999995,-0.40028937400000003
B.814,This was quite a stunning thing.,-0.295038898,-0.013644688000000026,-0.1388134026,-0.44020712999999995,-0.21708470200000002,-0.22525197979999997
B.815,I think it's been very encouraging.,0.38713972105999994,-0.20386854899999998,-0.07783267999999999,-0.27618458500000004,0.13398553000000002,0.11584908458000001
B.816,No one's coming to get you.,-0.2653684748,-0.22022600360000003,0.2269628136,-0.19193675600000001,-0.28014843640000003,-0.231830078
B.817,I thought you might be praying.,-0.31330312,-0.26834900500000003,-0.12376154575,-0.4484157675,-0.2582372825,-0.2804364575
B.818,I knew I couldn't trust you.,0.019765283999999994,-0.0853023096,0.3367802328,-0.0523112702,-0.12019790600000002,-0.046405110000000006
B.819,I'm not crazy about blind dates.,0.09196808499999998,-0.293135714,-0.294127126,-0.5386140792,-0.33378004000000006,-0.22959004199999997
B.820,Then you're lucky I came along.,-0.4481068592,-0.3768768116,-0.5560280850000001,0.176248768,-0.384800168,-0.36809181399999996
B.821,I have to ask you that.,-0.43679388,0.34236973400000004,-0.43819194800000005,-0.111382852,-0.41117250400000005,-0.3051275479999999
B.822,Ruby takes off towards the Cineplex...,-0.22081116,-0.04685761399999998,-0.1583421672,0.1652914838,-0.1037503968,-0.1105395204
B.823,She's going to wash your Jeep?,-0.545017952,-0.500931994,-0.33020674799999994,-0.51164073,-0.5679943333999999,-0.535220322
B.824,How can you choose this lifestyle?,0.486514752,0.204576118,0.06936337000000001,-0.038206556,0.24604977379999998,0.27228610799999997
B.825,"Curing countless diseases, not just ours.",0.63533466,0.6637772199999998,0.7126143468,0.626110965,0.9026126839999999,0.770514734
B.826,It wasn't even his terrible taste.,0.79912686,0.37655736,0.8016386999999998,0.4828614280000002,0.848997812,0.747664766
B.827,How much time do you have?,-1.0158948159999999,-0.28762985399999996,-0.7039591940000001,-0.4258853926,-0.6196652699999999,-0.674274754
B.828,I go back to work tomorrow.,-0.0463790226,-0.700444304,-0.29998704,-0.5944838939999999,-0.38870422000000004,-0.34651729800000003
B.829,You should practice lying more often.,0.14353479,-0.20735399399999999,0.506262262,0.35282548399999997,0.191603626,0.16155949399999997
B.830,What do you want for free?,0.20338176800000002,0.641372982,0.47798330799999994,0.38514822000000004,0.36697731599999994,0.36515370799999997
B.831,I'm just here with another girl.,0.5301255460000001,0.868737516,0.39293270399999997,0.261177632,0.24904633,0.408182186
B.832,Then you must keep it true.,0.370055295,-0.12805159700000002,0.49270308720000006,-0.15150215439999998,0.092636458,0.144493246
B.833,I used some of your soap.,0.34159059999999997,0.06529822200000004,0.06753893,-0.245238134,-0.022979707999999998,0.07256145600000002
B.834,I got pinched in the elevator.,-0.234852004,-0.07691450999999998,0.04550674400000003,0.023824819000000018,-0.203582514,-0.16418591
B.835,You mean she's not coming back?,0.455785602,0.33621059999999997,0.005220816600000022,-0.011091077999999999,0.460322272,0.3808360374
B.836,"Craig, darling are you in there?",-0.058531212,0.15580908,-0.343346206,0.09359617999999997,0.113293736,0.04418465999999997
B.837,It was just a fishing expedition.,-0.5906938260000001,-0.36040320600000003,-0.445225076,-0.04316301119999997,-0.693331332,-0.5613420232
B.838,I don't want to discuss it.,-0.188868354,-0.6497765620000001,-0.8068218908,-0.48682908280000003,-0.408164252,-0.40949829800000004
B.839,Did your wishes ever come true?,-0.09193710439999998,-0.204244294,-0.27760274999999995,-0.3397366,-0.520806052,-0.34064951471000005
B.840,"Macaulay, you drew up Wynant's will.",0.532843935,0.7034709979999999,0.84804022,1.0220662202,0.7644467782000001,0.7204868731999999
B.841,"Some of it good, I hope.",0.202275638,0.0013360800000000062,-0.2907639292,0.184290758,-0.07388725999999997,0.014874883999999988
B.842,"On your ear, you've got something.",-0.20565763,0.24505059200000004,-0.11795003999999998,-0.291518588,0.324033739,0.10110385599999998
B.843,It probably has the Dumper's name.,0.343357132,0.7336640489999999,0.703527228,0.6551864832,0.8583890860000001,0.682400354
B.844,There's always risk -- life's a risk.,0.1602170796,0.58956939,-0.06800672399999999,-0.139906594,-0.158327158,0.02355703799999998
B.845,I'll see what you can do.,-0.15971332500000002,-0.014855921200000006,0.0744091288,0.5637539500000001,0.448871098,0.218021016
B.846,I told you what to do.,-0.14216214659999998,-0.297763392,-0.41719508759999996,-0.20623255999999998,-0.42003418400000003,-0.3153062416
B.847,Can't go anywhere without an inhaler.,0.26472193200000005,-0.040348603999999975,0.391752824,0.024704382000000025,-0.265745076,-0.036653698000000026
B.848,I told you to stay hidden!,-0.2313470532,-0.028656859999999996,-0.212211418,-0.6395818240000001,-0.44191991799999997,-0.337337452
B.849,"Shwoof, that makes me feel better.",-0.05024618660000002,-0.04366018200000001,0.010562657999999975,-0.19089596000000003,-0.012880574,-0.0386477932
B.850,Why's his britches round his knees?,-0.0987771768,0.20582138521999999,-0.07658933000000001,-0.008447868199999996,0.03777669148000005,0.01174919815319998
B.851,I didn't say you were scared.,0.046323572000000014,0.219540028,0.534326648,0.10497120000000001,0.39300190599999996,0.26686495000000005
B.852,You know what your problem is?,-0.038015653999999954,0.313713238,-0.31514830600000004,0.2526037444,-0.24495585000000003,-0.08868404399999999
B.853,"I'm a hemotologist, not a detective.",0.232795964,0.05144242320000001,0.3254581378,0.20902327400000004,0.087384796,0.144973256
B.854,You'd have to get me inside.,0.036355959999999986,-0.005863256000000016,-0.07662764800000002,0.41214866499999997,-0.137328192,-0.029967172000000007
B.855,And that's the power you have.,-0.335204741,-0.08237935200000002,-0.23049206800000005,-0.433055605,0.21516786699999998,-0.04250262400000002
B.856,Because... I didn't think I would?,-0.013963053000000003,0.32756528,0.5363623618,1.2689436,0.611593524,0.4573700479999999
B.857,We don't want to be disturbed.,-0.07434784,-0.4886063475,-0.45785363749999997,-0.584542565,-0.4687405375,-0.37513238
B.858,What do they need her for?,-0.45323402799999996,-0.8214098400000001,-0.847690448,-0.10440136,-0.40159910400000004,-0.4703826168
B.859,Is that all you care about?,-0.1512103038,-0.6380305,-0.220262876,-0.44386583,-0.602261708,-0.45247681479999996
B.860,How does he look up close?,-0.08032013999999998,0.33792564999999997,-0.288145338,-0.03209250120000001,0.21462509599999996,0.10275033159999998
B.861,What happens when the baby comes?,0.5132285312,0.206741194,0.219342273,0.2934051306,0.177686098,0.281175024
B.862,"Just please, give me the ticket!",-0.28405241200000003,-0.17162133799999998,-0.306762992,0.12693790300000005,-0.17172884799999996,-0.186736132
B.863,Learn how to speak English first.,0.5017038628,0.0031946840000000145,0.17001911,-0.25241851400000004,0.25047337719999996,0.24365311899999997
B.864,You're going to miss your train!,-0.2764985346,-0.006705344000000013,-0.350117646,-0.44135690326,-0.35194769800000003,-0.296750238
B.865,"Mommy, please don't call me that.",0.014657538000000015,-0.037050991999999984,-0.19812751020000002,-0.343471784,-0.005461448800000004,-0.04128792199999999
B.866,"Our prayers have been answered, Turkle!",-0.388153648,0.05527503400000007,-0.42318568,0.16667596960000003,-0.347700838,-0.27474751799999997
B.867,"I think I love you, mate.",-0.40724283759999996,0.727108356,0.5458727572,0.443434408,-0.010263915999999984,0.042404448000000004
B.868,Things won't change... you know that!,0.49085069800000003,0.331934326,0.42622334478,0.413651062,0.16504234720000005,0.306001666
B.869,"You don't, you can't believe that...",-0.006487779999999996,0.28222358659999996,0.062889472,0.300648996,0.426741884,0.26329914079999994
B.870,"Ellie, it was a formal party...",0.21905835999999995,0.23812175400000002,-0.269136882,0.09045688600000004,0.019442114000000028,0.08686301599999995
B.871,I just have to get something.,-0.179208301,-0.248514772,-0.431000932,-0.275465354,-0.289808934,-0.26294501200000003
B.872,Worse than your Kraft Holiday dip?,0.597271126,-0.21138486400000006,0.08655830600000004,-0.19182697399999998,0.275158248,0.25422975999999997
B.873,Keep that thing away from me.,-0.007356342199999988,0.015261405999999967,0.316611496,0.135173182,-0.11977648200000002,-0.028072577199999983
B.874,Want to tell me what happened?,-0.18662251200000002,-0.28097985799999997,-0.10852842373999998,0.20327511,-0.050232632799999996,-0.09849794340000001
B.875,I know what you're gonna say.,0.314142294,0.39997547,0.280161196,-0.22517983900000002,0.283180704,0.26665163999999997
B.876,Keep in touch with my secretary.,0.840801478,0.7041495070000001,0.435111502,0.122186198,0.166261036,0.42261079000000007
B.877,I still haven't heard from Pendergast.,-0.07668982599999999,0.003983118599999983,-0.12135664800000004,-0.265085648,-0.191663104,-0.13888408800000002
B.878,I'm out here looking for Leo.,-0.15409594599999998,0.1985126412,0.21143024800000004,0.23985720399999994,0.1309260618,0.07696956279999999
B.879,How do you like your coffee?,-0.30122888400000003,-0.356037182,-0.441143572,-0.14688929579999999,-0.1442076978,-0.229449804
B.880,Here turn around and face me.,-0.3134772102,0.25372390000000006,-0.211410206,0.23336328980000004,0.44952643800000003,0.16805318600000002
B.881,He gave me a great deal.,-0.05003559999999998,-0.11668304399999996,0.08931025800000002,-0.028169139999999992,-0.10013221359999999,-0.07206733399999998
B.882,I don't want you to die!,-0.0015296227999999968,-0.4338117562,0.11894970200000002,-0.10801104319999999,-0.09838506799999999,-0.101270908
B.883,I thought it was very unique.,-0.09876789199999998,0.170403598,0.176755032,-0.2255768566,0.0925800212,0.032301604799999994
B.884,I'll tell you that joke again.,0.052129925799999956,-0.10629456935999997,0.2453387488,-0.03763931,-0.058510647999999985,-0.015278750000000008
B.885,I've continued working on the case!,-0.22077010599999997,-0.6753304680000001,-0.5353986159999999,-0.42897288600000005,-0.386619672,-0.390048028
B.886,You're the one who started it.,-0.667128685,0.35101617374999994,0.37177206250000006,-0.011329305000000012,-0.3717482175,-0.289883884
B.887,I'm getting custody of the kids.,-0.01742887999999998,0.43808081560000006,0.49063748799999995,0.44539350520000004,0.137632026,0.1778017158
B.888,Tell them I needed a rest.,-0.017038335999999998,0.130115458,-0.16223888400000003,0.009396119999999985,-0.05512051800000002,-0.024052468
B.889,"It was a shark, wasn't it?",-0.16106090800000003,-0.225798346,0.2720388996,-0.3222787356,-0.0923601588,-0.12239177279999998
B.890,I thought that you were anyway.,0.17182964600000003,0.2940127322,0.182931207,0.816956448,0.393978872,0.342703968
B.891,"No Legal, Tax or Investment Advice.",-0.088888696,-0.39335295800000003,-0.58859976,-0.63665471416,-0.22508311200000003,-0.26270791400000004
B.892,AWA shall provide applicable training materials.,0.44588841079999997,0.008222286000000013,0.38228662,0.391532132,0.374740202,0.350715552
B.893,Opinion of Counsel for the Underwriters.,0.52969147917,0.344045916,0.9936439399999999,-0.016137624000000007,0.41682285199999997,0.43940393800000005
B.894,Letters of Credit Issued for Subsidiaries.,0.223085926,-0.015043540199999993,0.6556792579999999,0.32340714200000004,0.419424956,0.3215971494
B.895,Transfers out of the bargaining unit.,0.4033263464,-0.178359182,-0.493902454,-0.9601645754,-0.18110506199999998,-0.10447810399999997
B.896,Rb binds more than 100 proteins.,0.13435774,-0.010320856000000012,-0.11869244600000002,-0.155841824,-0.136561866,-0.05004174500000005
B.897,As with ectopic division and apoptosis.,0.0076737104,0.693049036,0.9253199206,0.582660516,0.323852678,0.34098529433999997
B.898,Section ISH using rat Shh probe.,0.17311943000000002,0.7574262978,0.06880575299999998,0.861892744,0.706182452,0.545225306
B.899,Two independent compounds tested in Tg2576.,-0.13821898,-0.36054027800000005,-0.6300977839999999,-0.37325277720000005,-0.133312532,-0.21029805000000001
B.900,The mutant allele lacks exon 14.,-0.23010087119999997,0.29841262999999996,-0.07662833599999999,0.174278926,0.03502287540000002,0.0009109880000000015
B.901,But two groups are in confrontation.,0.5526223894,0.457484412,0.31761286199999994,0.24294788399999998,0.29192682200000003,0.37873163596000003
B.902,Oh Hjalmar Wentz must have been.,-0.02726179000000003,-0.225122,0.270077518,0.03361368759999998,0.29620175559999995,0.125809494
B.903,Well kept facility with friendly staff.,0.41182463,0.46801995080000003,0.5440818796,0.730665812,0.46178379999999997,0.47476065
B.904,Passport needed for international boat cruise?,0.14418127,0.38226248799999996,0.158252468,-0.03793267400000002,-0.0026514799999999726,0.08988902599999996
B.905,We'd only met ten minutes before.,0.23664625,-0.025220529999999998,0.02974889879999998,-0.22114020399999998,0.373873789,0.22314702119999996
B.906,Hey kido u made me smile.,-0.049428525999999987,0.816035944,0.0969472572,0.365141756,0.47959230799999997,0.349067054
B.907,"After that, what do we do?",-0.593227076,-0.48679345000000007,-0.809010028,-0.669878464,-0.5409749152,-0.57408546
B.908,The place is chill and comfortable.,-0.2275607088,0.18306489812399998,0.475490876,-0.14811539999999998,-0.019422513400000008,-0.02991961699999999
B.909,"Nice selection, very clean, friendly staff!",0.2746453248,0.11184685999999999,0.2007079912,0.3740767558,0.15671288,0.20161053199999998
B.910,The drawstring just completes the fit.,0.151765304,0.16584684999999996,0.355077216,0.010649995999999962,0.2187871218,0.1869642426
B.911,Wishing your husband a happy birthday!,0.16114049199999997,0.14810652800000002,-0.02568261000000003,0.4036798439999999,-0.035731206,0.07270000600000001
B.912,Asked her question and did nothing.,0.510452904,0.45236571799999997,0.7295590839999999,1.058311702,0.917392626,0.7528304259999999
B.913,Five Toes: Silkies have five toes.,0.011772824799999993,0.26919439800000006,0.7807265859999999,-0.05553333399999999,-0.022366459999999977,0.0677262246
B.914,"Just then, the front door slammed.",-0.383298686,-0.254203686,-0.06061614,-0.1055623668,-0.140083934,-0.2108135
B.915,Just received from your flower store.,0.02848651,-0.09048324320000004,0.10152045999999997,0.24394605499999997,-0.131815182,-0.041826122
B.916,She manifested him at another level.,0.14049049,0.1000266018,0.46478444999999996,0.293228601,0.21288839399999998,0.20126862
B.917,"In brief, inferiors salute superiors first.",0.666475516,0.31846261400000003,0.50785386,0.43006977539999997,0.353976992,0.44724029
B.918,I give this dealer an A+!,0.6666872506,-0.120528924,0.320909282,-0.19170991720000002,0.1475695192,0.2366720834
B.919,The stewardesses are furious with them.,0.162959024,0.013736643999999998,0.43854631,0.66545238,0.267039799,0.24938699048
B.920,"Well, this may be an exception.",-0.06135679599999999,-0.601264252,-0.4047337636,-0.11197850200000001,-0.058675966999999996,-0.15015159214
