item_id,sentence,lang_LH_AntTemp,lang_LH_IFG,lang_LH_IFGorb,lang_LH_MFG,lang_LH_PostTemp,lang_LH_netw
B.371,She collapsed onto the comfortable bed.,0.029712615999999987,0.32347766599999994,0.10687864600000001,-0.08389886399999999,-0.252079954,-0.07333608000000001
B.372,It's quite apparent we have problems.,-0.009958385399999981,-0.3330346146,0.245238612,0.10954792200000003,0.203046866,0.07701872800000001
B.373,Does he have a name badge?,-0.527198012,-0.01220298600000005,-0.501765354,-0.6051480272,-0.707677804,-0.5553008528000001
B.374,An escalating excitement hurried her words.,-0.349195714,-0.6186042900000001,-0.7514919339999999,-0.296557332,-0.306760192,-0.38176962
B.375,"Nothing broken, just very badly bruised.",-0.38932156399999995,0.235966458,0.365331274,0.32182540200000004,0.005073792000000044,-0.025319477999999986
B.376,"But he had a dog, yeah?",0.006986829999999999,0.17553892400000004,-0.14311620860000002,0.151130896,0.178235944,0.11133188199999997
B.377,"Dirty, smelly clothes littered the floor.",-0.36788899799999997,-0.11621958799999998,-0.345170946,-0.358522042,-0.047968967999999994,-0.18226109199999999
B.378,Central Park was across the roadway.,-0.31689393379999997,-0.048920384,-0.487654532,-0.39958711,-0.13285683099999998,-0.21286754599999996
B.379,The homeless woman obviously loved animals.,0.0018547200000000208,0.056799792800000026,0.23920714800000004,-0.221804764,0.37540764800000004,0.184332886
B.380,"The bag was leather, black, small.",-0.17518520199999998,-0.2759990764,-0.45940524800000004,-0.01138110000000001,-0.10892690599999999,-0.1603264134
B.381,Like a late night comedy sketch.,0.14399572999999996,0.770750314,0.602209496,0.23946063200000003,0.06833764040000001,0.21875783799999998
B.382,"The healthiest, most nutritious food ever.",1.0203932779999998,0.40733014599999995,0.22202906999999997,-0.06903391400000002,0.564307812,0.596944922
B.383,"Will you drink to that, boys?",0.261933286,0.42177764799999995,0.13695279200000002,-0.41118467000000003,0.15548457799999998,0.1716983
B.384,"At least three, maybe four kids.",-0.182983292,0.009660701999999998,-0.272720668,-0.18186215,0.11272495399999997,-0.023478182000000025
B.385,That marriage ultimately ends in divorce?,0.6099135880000001,0.32483220920000005,0.38980320139999997,0.485969996,0.7782453576,0.6331020784000001
B.386,That kind of understanding and kindness...,-0.25144252,-0.326418828,0.027409760000000016,-0.362046332,0.052616569999999994,-0.10688274
B.387,Why go and stir that pot?,-0.07819628840000001,0.1408902816,-0.042721901999999985,-0.15677769000000003,0.12560404076,0.042017363800000006
B.388,"Quite simply, it was becoming tiresome.",0.015541818000000008,-0.598946212,-0.787738308,-0.30968296399999995,-0.3558049056,-0.3096458164
B.389,I'll show you my new dance.,-0.240328924,0.209821904,-0.28659881600000003,-0.622440115,-0.374801172,-0.281786442
B.390,Something that awakened my psychic knowing.,-0.17748320799999998,0.23146951000000002,0.6254540420000001,0.529506498,0.411066632,0.2556300252
B.391,The protracted silence became almost unbearable.,-0.425623222,0.16871043400000002,0.3740403518,0.21555668199999997,-0.09739599523,-0.09965067679999999
B.392,With charming conversations and witty sparring.,0.35848081200000004,0.2675296788,0.4868815448,0.683107742,0.4766005092,0.436328942
B.393,"Not just physically but intellectually, emotionally.",-0.008742983540000027,-0.497340574,0.26820997599999996,-0.1182753388,0.021221685999999997,-0.04554364400000001
B.394,Fleas infected with plague literally starve.,0.75004213,0.8133563199999999,0.549565004,0.967232478,0.871109146,0.8201454800000001
B.395,And stitches all over the place.,-0.15417298399999999,0.0334325034,-0.055259812000000005,-0.24236571060000003,-0.39270337280000006,-0.2462010646
B.396,"In fact, he looked downright uncomfortable.",-0.03243419600000001,-0.1966718416,0.012514950999999996,-0.4426557059999999,-0.0637448488,-0.09592172000000002
B.397,Violent moons around a dead planet.,0.1714871708,0.329369036,-0.006336806800000016,0.20363325599999998,0.03060093800000001,0.115103174
B.398,"I was so embarrassed, so ashamed.",0.05566615399999999,-0.4224745260000001,-0.208951718,-0.710146256,-0.524299212,-0.353951874
B.399,I needed to test your methodology.,0.302195327,0.385140118,-0.179529416,-0.16240403,0.34736340080000006,0.26959503799999995
B.400,We went hiking at Bear Mountain.,0.4786483722,0.019654380400000025,0.235610863,-0.002962790399999982,0.06963855159999999,0.17603816499999997
B.401,Wild horses couldn't keep me away.,-0.06134011399999999,0.26841773999999996,0.20015234509199997,0.0634048288,0.10439535640000001,0.08316886987999998
B.402,They fled Russia after the revolution.,0.32120021339999993,0.562272872,0.12063566560000001,0.26728822,0.37496838000000005,0.360077544
B.403,Were narrow field stones set perpendicular?,0.04057319999999999,0.549021966,0.4132243054,0.905887156,0.07397195599999998,0.206609036
B.404,Could a spark explode the fuel?,0.088903542,0.051260840859999976,-0.259840882,-0.26007610200000003,0.235199924,0.10677827599999998
B.405,Let this be quick and simple.,-0.030511922799999997,0.1361778918,0.2552963346,0.24176682000000005,0.062922424,0.07230298299999999
B.406,Three large ones and three small.,-0.19604754959999998,0.7542810426,0.20425949599999998,0.17509504399999995,0.10500009399999999,0.11568457700000001
B.407,Her feathery blond hair hung limp.,-0.301956966,0.28512645360000005,0.37028973499999995,0.3268207636,0.049443834,0.025628446000000006
B.408,And the criminal investigation will continue.,-0.10860277100000001,0.479596284,0.41766879799999995,0.2667967382,-0.150128654,0.0031973119999999856
B.409,But then somehow I stopped myself.,-0.031922153999999994,0.031133321999999984,-0.030089663999999995,0.49133001600000004,-0.155152558,-0.043207745199999995
B.410,She started moving the excavated sand.,-0.23385616539999998,0.141353528,-0.013082873999999977,0.731283176,0.24557552339999997,0.127737424
B.411,I had bullets in that gun!,0.014658662599999992,0.4397321402,0.23678795600000005,0.38839223,0.25814812800000003,0.22453564200000004
B.412,"The evidence is contradictory, at best.",0.41124542580000006,0.866441816,0.614244974,0.646132108,0.7713959045000001,0.6688382799999999
B.413,They deal in commercial property investments.,0.005538038000000012,-0.49025943000000005,-0.23920064700000002,-0.555016774,-0.11976128719999998,-0.172013808
B.414,Fishes swimming in a turquoise paradise.,-0.4693961,-0.261518246,-0.48610379560000005,-0.305336304,-0.7116757269,-0.54847072
B.415,The bathroom needed a complete scrubbing.,-0.15413301799999998,-0.29954142,-0.26049966599999996,-0.4548639876,-0.029649833999999986,-0.1415770452
B.416,He's in the quantum physics department.,0.15488783700000003,0.522175734,0.310722184,0.259360244,0.15989082599999999,0.21922919200000002
B.417,"He was too skinny, almost skeletal.",0.274425454,0.50113611,0.538727622,0.25594017300000005,0.32420795199999997,0.340226848
B.418,Talk about a wild goose chase....,-0.18977622600000002,-0.148356006,-0.14423408399999998,-0.06907110200000002,-0.2517480766,-0.202445586
B.419,Something big got the ball rolling.,-0.2000449424,-0.39030197600000005,-0.3380488562,0.06381543999999999,-0.34878684800000004,-0.282464484
B.420,Another spike in unemployment was predicted.,0.587615474,0.26877211259999995,0.6798362572000001,0.32725360800000003,0.8839100419999999,0.6762195146
B.421,Opposite ends of the same axis.,0.288713936,0.9084845360000001,0.32041958234,0.171412398,0.232815756,0.3302905136
B.422,I enjoy her chocolate fudge cake.,-0.16464267749999997,-0.166140514,-0.10547172999999996,-0.19477816,0.10361777999999999,-0.0353112632
B.423,The cold spring weather helped little.,-0.7849683839999999,-0.5781933340000001,-0.5784687500000001,0.06862912200000001,-0.438344574,-0.5166997999999999
B.424,The emperor of the despondent kingdom.,-0.08850502666,0.129275922,-0.104372392,-0.21719063160000002,0.006744954800000003,-0.027245779999999987
B.425,"She leaned over him, sobbing openly.",-0.04856846600000002,-0.14429572,-0.36059215,-0.383759542,-0.003913355999999979,-0.08309868999999999
B.426,She stirred sugar into her tea.,-0.447920624,-0.3542078584,-0.558117914,-0.462024922,-0.429625012,-0.43546458999999993
B.427,No stuffed animals resembling a kangaroo?,0.3338998744,-0.1308660352,0.028952035199999983,0.1129396302,0.152638696,0.1556215624
B.428,There was shouting and loud noises.,0.13051392,-0.276620484,-0.16267308480000003,-0.49078433599999993,-0.22460897086,-0.15367601799999997
B.429,She looked like a fairy princess.,0.04418846480000001,-0.43148256000000007,-0.40627930599999995,-0.43438010800000004,-0.058465408399999995,-0.1261815296
B.430,Her wisdom and foresight is evident.,-0.063985072,-0.5199192189999999,-0.06195428600000001,-0.569559326,-0.3815262282,-0.309619668
B.431,To sell on the black market?,-0.089279688,0.04762752420000001,-0.22098261199999997,-0.573956162,-0.31366190400000005,-0.22473753
B.432,I ignored his arrogant little comment.,-0.5143246552,-0.463364096,-1.051031358,-0.4535037859999999,-0.2361726044,-0.40269211800000004
B.433,We made promises of eternal love.,-0.5107683108,-0.127622164,-0.462886582,-0.471298356,-0.37150055000000004,-0.39172988999999997
B.434,Humanitarian outreach and consolidation of control.,-0.22605092799999998,0.04861185399999999,-0.19159299999999999,0.2995123326,-0.1949754512,-0.13570495880000003
B.435,The ceremony will take place tonight.,0.48190130480000004,0.5631794903999999,0.502153568,0.2997338342,0.4393887899999999,0.45879307599999997
B.436,What about a car or truck?,0.086947778,-0.7562277980000001,-0.428011136,-0.08258961999999996,-0.20941215400000002,-0.20103612799999998
B.437,"I felt awful: exhausted, weak, upset.",-0.3363704192,-0.259330664,-0.23734861699999996,-0.45977525799999996,0.05851609200000002,-0.141665128
B.438,Growing vegetables and tending the garden.,-0.561564482,-0.491019922,-0.9448826479999999,-0.118774282,-0.341966744,-0.437252242
B.439,He felt silently and secretly fulfilled.,0.10331760400000001,-0.2011228606,0.2143118462,0.473070826,-0.31754100399999996,-0.10008783399999999
B.440,Painter stepped closer to the technician.,-0.413056836,-0.241224675,-0.36208768999999996,-0.37644604800000003,-0.36873084800000006,-0.365131258
B.441,Wet hair clinging to her cheeks.,0.02207462200000001,0.052320769999999996,-0.028897351999999987,-0.32358269799999995,-0.133442564,-0.077991646
B.442,Eventually some of them became legends.,-0.033077284000000026,-0.593846168,0.23990225199999998,0.079199198,-0.6401172361999999,-0.3665572728
B.443,She felt foolish and oddly frightened.,-0.218791432,-0.37582597599999995,-0.023749782000000042,0.03984776331999999,-0.13187886519999997,-0.164927228
B.444,"Crisp, fresh onion, just enough cilantro.",0.44972652020000004,0.5209078899999999,0.398444024,0.369644038,0.48286744600000003,0.46504890000000004
B.445,Nordmann considered it all very carefully.,-0.18359367799999998,-0.539176118,-0.498731126,0.03163143599999998,0.041322457999999986,-0.121783262
B.446,I even hired a medical practitioner.,0.04683848,-0.22709121599999998,-0.228980842,-0.338451018,-0.401432358,-0.24667628599999997
B.447,"Day before tomorrow, day after yesterday.",0.42185312399999997,0.813585264,0.92183818,1.46907447,1.017893312,0.8642040740000001
B.448,Was she a prescription drug addict?,0.4162099588,0.29924404400000004,0.236332004,-0.18504074799999998,-0.037503818,0.1284753036
B.449,Science and religion can indeed coexist.,-0.067940476,0.014834793800000013,-0.25738194600000003,-0.330587876,0.159101668,0.01930710000000001
B.450,"Consciously lying, he amended to himself..",0.283867216,0.36466458599999996,0.573083528,1.006462688,0.46968834400000004,0.45492086600000003
B.451,Tricked by his own damn ruse!,0.4416117394,0.14168878799999995,0.347770872,-0.12454006479999999,0.29411874400000004,0.2858809617
B.452,I picked up the razor blade...,-0.088977288,0.09099399199999998,-0.265768038,-0.5412582286000001,-0.439403358,-0.27970071
B.453,And we need a spy camera.,0.008256428000000015,0.38290741920000004,-0.11258222000000002,-0.21280052599999996,0.11895589200000001,0.082639706
B.454,Italy was rich with art history.,-0.146599308,-0.326322337,0.04629416236000002,-0.6407301320000001,-0.5445721204,-0.384797498
B.455,Floor to ceiling windows covered it.,-0.158930436,0.14755429500000003,-0.170846600392,0.23410444319999996,-0.017158006000000014,-0.02466639399999999
B.456,"She shrugged, hoping to look indifferent.",0.309957752,0.24106118899999998,0.167252846,0.10658719320000001,0.544623406,0.389731854
B.457,Why should the knowledge threaten you?,0.018487053999999985,0.1266881054,-0.06767648000000001,0.47424918599999993,0.46010095,0.272334512
B.458,"Was it fear, desperation, anger, grief?",0.028307741999999997,-0.23992117300000002,0.574038552,0.291301116,-0.0799558462,-0.0033004080000000103
B.459,We're wired into your alarm system.,-0.26432544,-0.185924942,0.06162598800000001,0.09668157400000002,-0.07303453199999999,-0.11628914000000001
B.460,The woman you suspect of murder.,-0.008086176000000011,-0.260300874,-0.33886066,-0.10800515399999999,-0.34221518396,-0.225945206
B.461,His preference for basketball over golf.,0.3808303599999999,0.16158031415000004,0.4924555420000001,0.663791288,0.5587063328,0.467473764
B.462,So smart and caring and hardworking.,-0.270438702,-0.23106137000000002,-0.25896474044,-0.222994168,-0.37047408600000004,-0.30917897400000005
B.463,A vampire can full on cry?,-0.23897052140000002,0.1968548,-0.19456148,-0.3127083766,-0.20945009799999997,-0.174832944
B.464,A student intellectual turned leftist radical.,0.9569376540000001,0.9537584459999999,1.158876346,0.504408316,0.5702242234,0.749294172
B.465,"Using magnetic resonance tomography, for example.",0.31866378100000003,0.703437974,0.294884194,0.628380262,0.4462846596,0.44862008600000003
B.466,Is he teaching religious-symbolism classes again?,-0.023614599999999996,-0.307221968,-0.38848138740000004,-0.04040489399999999,-0.198183601,-0.1647128796
B.467,And please not over the phone.,0.5526863082,0.9455465239999998,1.1454046039999999,0.559922036,0.867307944,0.7869626820000001
B.468,Have we seen the prosecution judge?,-0.09884649999999998,-0.4435714839999999,0.02822107700000003,-0.377629262,-0.4734906984,-0.33349113399999997
B.469,Then she laughed a barking laugh.,-0.358173006,0.013263221999999963,0.044203116,0.07404222799999997,-0.192000314,-0.176518809
B.470,A fully substantiated and provable fact.,-0.2152752688,0.02588392800000001,-0.2633886412,0.045494776,-0.24773508,-0.1845017554
B.471,It was an upstairs back bedroom.,-0.248269212,0.034607206,-0.39173128475999996,0.07910655199999997,-0.3974473676,-0.26887406
B.472,It's built around an enclosed courtyard.,-0.15226777919999998,-0.525944574,-0.41531063600000007,0.018110106000000004,-0.36119442399999996,-0.300377914
B.473,That was so irresponsible and dangerous.,-0.07546476580000001,-0.2261933256,-0.32228303,-0.48957135538,-0.256750136,-0.22680842559999997
B.474,Long chandelier avocado colored earrings glistened.,-0.5676596584,0.515248802,0.391794544,0.66268806,-0.010017495999999992,-0.018147940000000008
B.475,"Unfortunately, my answers weren't any different.",0.14637546400000004,-0.568067,0.5480432954000001,0.385097344,0.5247726580000001,0.28272167000000004
B.476,Beyond the limits of the law.,-0.18426777200000002,-0.18352073600000002,-0.0681262252,-0.43995863,-0.364846454,-0.2830277474
B.477,My skin feels like melting wax.,-0.36646484399999996,-0.04367438580000001,-0.295155454,-0.4089677599999999,-0.6067886532,-0.44109282
B.478,Guitar chords lent a soothing strum.,0.049364874,0.171761078,-0.20268259400000002,0.31507000199999996,-0.07542586599999997,0.009703535999999985
B.479,She pointed at my swollen jaw.,0.1229124608,-0.26849814,0.25002694000000003,-0.105260328,0.052212726,0.031772864799999995
B.480,"In particular, my hand remained motionless.",-0.09623233300000002,0.149667498,0.35849588599999993,0.21772789,0.376159583,0.210703204
B.481,Armed security guards arrived in force.,0.06822822999999999,0.61876989,0.8693774554000001,1.3564063100000001,0.25255983,0.3694524
B.482,I don't have dissociative identity disorder.,0.32399839799999997,0.2083959354,0.25139763400000004,0.61727196,0.6378464239999999,0.47798977160000006
B.483,As if that would impress anyone.,-0.086479356,-0.5151933559999999,-0.304380456,-0.5708348374,-0.42122957440000003,-0.348605572
B.484,He had partners and an assistant.,-0.29438534,-0.20144700199999996,-0.665366378,-0.276785764,-0.366308602,-0.33838227600000004
B.485,Check some of my reference books.,0.111833398,0.04059664,-0.15725550273999997,-0.09687540160000001,0.06601996600000001,0.049234837200000006
B.486,He was a United States Senator!,0.13040274899999998,0.561917039,0.19121929800000004,0.368904128,0.3872393544,0.32746947200000004
B.487,The voice had a muffled sound.,-0.48908397,-0.22672736600000004,-0.43717970720000005,-0.7895028660000001,-0.46187111999999997,-0.46395377799999993
B.488,To revive her or help her?,0.3053809828,-0.10521396200000002,0.20771953460000003,0.17633218120000002,0.16225086800000002,0.17135059600000002
B.489,His lungs were filling with blood.,0.326851872,-0.021489252000000007,-0.02031854150000002,-0.736888762,-0.44787104,-0.18775119000000004
B.490,Can I wear a long dress?,-0.745367956,-0.657902666,-1.1945351118,-0.322701138,-0.576279076,-0.6486301007999999
B.491,Probably a printed Microsoft Paint file.,0.597118604,0.747037682,0.805200771,0.6697109259999999,0.8899663927999999,0.773366436
B.492,Water drips from the exhaust pipe.,-0.09027258399999998,-0.242093818,-0.31288525600000006,-0.17879043,-0.34525541400000004,-0.2507320806
B.493,It was the mathematical constant pi.,-0.6634861439999999,0.009408059999999985,0.09507601400000003,-0.336296952,-0.427782326,-0.39858424000000003
B.494,The gene heavily influences brain wiring.,0.09664517199999996,0.45697455800000003,0.20530078999999998,0.540178834,0.587179508,0.415281565
B.495,The northernmost mountains in central Germany.,0.03199776075999998,0.430414886,0.19016581999999999,0.155611888,-0.025632053999999994,0.07177511632000001
B.496,I didn't sense any immediate danger.,-0.342666143,-0.2895760088,-0.7209350128,-1.057871064,-0.6949645,-0.581818265
B.497,Especially the priest in our church.,-0.11044464599999995,0.3303544492,-0.341646712,0.104526486,-0.10234378200000001,-0.050478862
B.498,Maybe they had a platonic relationship.,-0.22242020599999995,-0.06523198800000002,0.02697093600000002,-0.31899649399999996,-0.159735496,-0.165743572
B.499,Pine cones and tree bark too.,-0.8906307740000001,-0.21966195439999997,-0.3361803,-0.56275018,-0.17348048,-0.4079613
B.500,Painter refused to disappoint his mentor.,-0.23702833100000004,-0.12781871520000002,-0.496191754,-0.175438034,-0.42649106559999994,-0.32518885
B.501,That could be a commendable quality.,-0.644904906,-0.65977536,-0.48699928000000003,-0.99115038,-0.6387351800000001,-0.660668728
B.502,"No chicken soup, I want tomato.",-0.252346272,-0.41974364,-0.08593516000000001,0.09267769199999995,-0.18834149399999997,-0.20583105200000001
B.503,"Mild fever, slight headache, neck stiffness...",0.33940997119999994,0.0003441000000000027,0.337881502,-0.610343602,-0.006082458000000024,0.06056854799999998
B.504,King's handsome face looked almost demonic.,0.011428308000000009,0.1412972088,-0.01175854000000002,0.004103295999999994,0.13912884220000002,0.08632239
B.505,Did permission have to be granted?,0.7614172939999999,-0.22156887200000003,0.309733764,0.250462749,0.517167214,0.459140424
B.506,"Eyes turned to him, surprisingly bright.",0.23346695219999997,0.29078717559999995,0.176027315,0.33491279399999996,0.7652253059999999,0.49896207800000003
B.507,The official diagnosis was a stroke.,0.2463250644,-0.12102901799999999,0.40018293099999996,-0.04354125,0.062963492,0.10114801599999998
B.508,"Maximum impact, least amount of effort.",-0.2448669432,-0.14547907200000001,0.334784722,-0.118041328,0.021796430000000012,-0.060867308799999985
B.509,"She was delicate always, now extremely.",0.374077708,0.9859827560000001,0.7983686999999999,1.247819472,1.14590953,0.9094876089999999
B.510,Yes she isolated various radioactive atoms.,-0.10240270999999997,-0.025955540199999995,-0.14502213599999997,0.028537449999999985,-0.501960604,-0.27672825199999995
B.511,Fredriksson was the acting news editor.,0.310214476,0.09722398999999997,0.15817666300000002,-0.0037580519999999783,0.17761589600000002,0.18789192520000003
B.512,They pay cash and tip little.,0.736849506,0.28611632600000003,0.04088808848000001,-0.152605164,0.5133732986,0.46572252360000005
B.513,All the way to the rear!,-0.7179153580000001,-0.29756855200000004,-0.6526304524,-0.5626965439999999,-0.808646832,-0.694461502
B.514,"Both wearing white, untucked, long-sleeved shirts.",-0.75480096,-0.665861854,-0.755120848,-0.653487288,-0.33755584199999994,-0.5367982899999999
B.515,Heavy fabric stretched on steel frames.,0.195870528,0.028776292000000002,0.04758164100000001,0.348418396,0.0631511384,0.114831292
B.516,A bunny can be fluffy sometimes.,-1.023086688,-1.452313514,-0.9476266680600001,-1.0925406880000001,-1.0063751,-1.0680374579999998
B.517,"However, that wasn't an immediate improvement.",-0.09120823400000001,-0.390806658,-0.7935008800000001,-0.091694915,-0.24530013,-0.2434524
B.518,How sturdy is the coffee table?,-0.637341036,-0.221195042,-0.47900215399999996,-0.5597067334,-0.564748978,-0.5366394085999999
B.519,"Unscrew, slide into place, lock, screw.",0.03908104080000001,-0.6179935320000001,-0.3542306272,-0.0031726639999999943,0.065249784,-0.055083111799999994
B.520,The Weasel was an accomplished backstabber.,-0.0008437753000000048,0.11683280600000001,0.1840521,0.024533551740000003,0.011929436999999998,0.03258854820000001
B.521,The brunette was licking her lips.,0.06048760320000002,-0.503045336,-0.501069916,-0.4867621,-0.152323366,-0.18512441000000002
B.522,Confessing your sins is the escape.,0.7129749031999999,0.23935540800000005,0.607777118,0.277896756,0.583919128,0.554248984
B.523,Diver on crew boat retrieves cargo.,0.4246567536,0.64748685,0.48606568,0.48034426999999996,0.42562234200000004,0.46012924999999993
B.524,Kindness and warmth emanated from him.,0.296282718,0.06920213820000001,0.07073395814000001,-0.030743871999999988,-0.057842078000000005,0.060928754499999994
B.525,She was near Grand Central Station.,0.024843250000000004,0.011033963400000003,-0.1122083648,-0.41504486400000007,-0.590815986,-0.3129213096
B.526,What one word would describe you?,-0.03070913000000003,0.547044758,0.81046808,0.948004968,0.614110036,0.47281806279999994
B.527,No one expected me to win.,0.14245390100000002,-0.331164192,0.467986916,-0.124155134,0.1751870802,0.099745656
B.528,Use your computer access for deciphering.,-0.10522982599999997,-0.648176702,-0.085208842,-0.008697023999999994,-0.23142267,-0.223009566
B.529,Afraid of what she might do.,0.285134566,-0.17946292554,-0.43192487400000007,-0.86334544,-0.21996421460000004,-0.14332369080000001
B.530,He glanced wistfully out the window..,0.018516219999999972,0.295269256,0.35224574999999997,0.26197681399999995,0.05686806,0.10905249800000001
B.531,I decided to neutralize the situation.,0.31671836779999996,0.5634414719999999,0.32213658200000006,0.107215274,0.07399961799999996,0.215026442
B.532,I still saw cynicism and contempt.,0.10879126600000003,-0.24149470599999998,-0.003765570000000057,-0.173838838,-0.08432303199999998,-0.05439902000000002
B.533,The code's too easy to read.,-0.43553368719999996,0.28740748000000005,-0.03517541999999996,-0.237441756,-0.04579449399999996,-0.122215772
B.534,"She leaned into him antagonistically, ""hunh?""",-0.19232288714,0.892435334,0.928798342,0.8913393879999999,0.6942027590000001,0.513180534
B.535,"Gross stopped briefly, then went on.",-0.08354987999999999,0.449720102,-0.240474252,0.0003344259999999988,-0.117420856,-0.03794290799999998
B.536,"Sharon, she's cooked in a restaurant.",0.394077108,0.26117618200000003,-0.160951742,0.051147156000000006,0.181345542,0.21680459699999996
B.537,There was no mistaking that scream.,0.154333018,-0.2566525048,-0.315827728,-0.54111458,-0.066054468,-0.08216644800000003
B.538,"Years of war, strain, and hatred.",0.17729721399999998,-0.49467491199999997,-0.156176476,-0.503369062,-0.22808730000000002,-0.17005474199999998
B.539,Form clay strip into a cylinder.,-0.09648508192000001,-0.08507773199999999,-0.48650080000000007,-0.47258829999999996,-0.33058180200000004,-0.25906283
B.540,I couldn't help laughing with him.,-0.559577772,-0.21399326259999998,0.11681223999999998,0.043013831200000005,-0.293936438,-0.304097568
B.541,Elizabeth Way was the first operator.,0.565964226,0.57304131,0.30056127800000004,-0.04711601089999999,0.335684968,0.39410650399999997
B.542,He also admitted killing Mrs. Hengesbach.,-0.04084774,-0.147574808,-0.210943426,0.51105579,0.17490294600000006,0.08117477799999998
B.543,I don't have the answer yet.,-0.35590874400000005,-0.270069762,-0.659085388,-0.75163362,-0.23849858799999998,-0.33766337
B.544,Now the government must do that.,-0.453479982,-0.313206766,-0.5124129,-0.29398792,-0.393690718,-0.39922719500000003
B.545,Then he realized he was hungry.,-0.009505750000000002,-0.1537285928,-0.50603225316,-0.2929500798,-0.35425402000000006,-0.24323485199999997
B.546,Bullets began to snap past him.,-0.1977750812,-0.789637648,-0.13642579,-0.53276444,-0.10396505147999999,-0.246705928
B.547,Others invoked technology and common sense.,-0.17647943380000003,-0.267454608,-0.21628112900000002,0.08441987599999998,-0.301745944,-0.2299430992
B.548,Ordered an investigation of Lumumba's death.,0.357696857,0.148919916,0.42430862999999996,0.7531135,0.2157622382,0.298572462
B.549,The courage to meet every challenge.,-0.2239505142,0.24815664500000004,0.547102526,0.2242219248,0.06260180934,0.050821004
B.550,Such study may take many forms.,-0.3895975176,-0.413263816,-0.443366578,-0.3043722946,-0.09220801960000004,-0.24701881859999997
B.551,Cut clay top and base pieces.,0.56281563,-0.07379511200000002,0.27943742,-0.13071200022,0.0981466912,0.19344154199999997
